arg-id,comment-id,argument
A304_0,304,ごみを捨てるときに燃えるゴミ／燃えないゴミ／危険物などを一瞬で判別できるようにしたい
A305_0,305,運動をするときにおすすめの場所やランニングコースといった場所を提示してくれるアプリが欲しい
A306_0,306,ティッシュがなくなったときに限って手が汚れる
A307_0,307,エレベーターが来るのが遅い
A308_0,308,Wi-Fiがたまに途切れる
A309_0,309,ポイントカードなどをいちいち財布から取り出すのが面倒
A310_0,310,電車のみならずレストランなどの混雑状況を知りたい
A311_0,311,本を借りるために図書館まで移動するのが面倒
A312_0,312,レジが混雑して面倒
A313_0,313,昼過ぎにくる急な眠気
A314_0,314,キャッシュレス決済不可な自動販売機
A315_0,315,学食がとても混雑する
A316_0,316,学食のメニューで人気商品はすぐに売り切れる
A317_0,317,朝きちんと起きれるかが不安
A318_0,318,レシピを見ながら料理をするときに、いちいち計量するのが面倒
A319_0,319,課題を出し忘れる
A320_0,320,家の鍵をかけたか不安になる
A321_0,321,電子レンジで温めたものを出し忘れる
A322_0,322,雨が降ると気づかず、洗濯物を外に干す
A323_0,323,雨の後、傘を干す作業が面倒
A324_0,324,カード決済をするとき、残高があとどのくらいなのかわからない
A325_0,325,次の授業がどの教室か忘れる
A326_0,326,次の授業が何時からか忘れる
A327_0,327,駅の改札内と改札外のトイレなど、場所によってトイレの混雑状況に差があり、たまにめっちゃ混む
A328_0,328,授業に必要なものを忘れる
A329_0,329,旅行などの荷造りでものを入れ忘れる
A330_0,330,家の掃除で、どこまで掃除機をかけたかわからない
A331_0,331,ご飯を炊いた後、残ったご飯を冷凍するのが面倒
A332_0,332,イヤホンの充電をし忘れる
A333_0,333,授業でUSBを使用した後抜き忘れる
A334_0,334,家を出るとき、エアコンを消し忘れる
A335_0,335,部屋が片付けられない。
A336_0,336,𝕏に時間を奪われる。
A337_0,337,ズボンのチャックが開いていた。
A338_0,338,紙の書類が見つからない。
A339_0,339,祝祭日だけ目覚ましの時間を変えるのが面倒。変えずにゆっくり眠れないのも嫌だ。
A340_0,340,朝シャツに着替える時に冷たいのが不快だ。
A341_0,341,雨の日に車のガラスが曇る。
A342_0,342,車に乗り降りする時に雨に濡れる。
A343_0,343,洗車してないので汚い。洗車は面倒。
A344_0,344,人とすれ違う時に右か左か決まっていると人類は幸せになれるのにと思う。
A345_0,345,仕事中も耳栓をしていたいが、見えない耳栓が存在しない。
A346_0,346,デスクにあるマウスやキーボードが邪魔。
A347_0,347,オフィスでエスプレッソを淹れていると変人扱いされる。
A348_0,348,靴の中になぜか小石が入っている。
A349_0,349,爪の端っこが裂けると痛くて最悪な状態がしばらく続く。
A350_0,350,電気自動車の充電中の時間を効率的に使いたい。
A351_0,351,髪の毛を自分で刈っているが、後ろを見ないで刈ることにリスクを感じている。
A352_0,352,写真を深度合成するのが面倒でSNSに投稿していない写真が数年分溜まっている。
A353_0,353,「傘」が100年単位で進歩していない。
A354_0,354,レーダーではなく、本当に今雨が降っているかを知りたい。
A355_0,355,息子のくもんの算数の答え合わせが面倒。
A356_0,356,息子のくもんの算数の答えが間違っていた時にどうして間違えたのかの分析をするのが大変。
A357_0,357,タイマーは時間が終わった時にしか鳴らない。
A358_0,358,お気に入りの鯛焼き屋があるが、遠方なのであらかじめ混雑状況を知りたい。
A359_0,359,社員の外国出張の費用計算をする時に、現地空港から主要都市への公共交通機関を調べるのが面倒。
A360_0,360,為替レートを大手証券会社のサイトに確認しに行くのが面倒。
A361_0,361,コーヒーを淹れる時に豆の量に対してどれくらいのお湯を注げばいいのかわからなくなる時がある。
A362_0,362,職場近隣の公共交通機関と道路の渋滞状況をリアルタイムで把握したい。
A363_0,363,雨の日と晴れの日で朝の準備物が変わるので、どちらで準備するべきか考えてしまう。
A364_0,364,忙しい時に限って天気の先読みを忘れる。翌日だけではなく3日先までの天気を起床時に手軽に知りたい。
A365_0,365,毎日食べる食品（納豆、牛乳）などを賞味期限から逆算してどれだけ買いだめできるかわかればいいのに。
A366_0,366,社内で研修をする時の配席表が自動的に作成されたらいいのに。
A367_0,367,社員の月間シフト表が自動的に組まれたらいいのに。
A368_0,368,手書きのアンケートをレポートにする時にタイプ入力しているので、手間をかけずできるようなものが欲しい。
A369_0,369,家事のタスクをアプリで管理しているが、どのタスクをするべきか自分で考えている。やるべきタスクを自動的にリストアップしてくれたらいいのに。
A370_0,370,家族が買い込んだお菓子の賞味期限を確認するのが面倒。
A371_0,371,クレジットカードの利用状況がお気に入りの金銭管理アプリに連携されない。
A372_0,372,写真を結合して印刷しているが、今使っているアプリは4枚同時の結合ができない。
A373_0,373,息子の算数力アップのために3つの数字の足し算の練習を楽しくやってもらいたい。
A374_0,374,長いデスクワークをした時の疲労度を知りたい。
A375_0,375,デスクワークが長引いた時に定期的な通知などでストレッチを促して欲しい。
A376_0,376,持っている茶碗のベストな積み方がわかればいいのに。
A377_0,377,1日のスケジュールを考えるのが面倒くさい
A378_0,378,電車の乗り換え時、ルートがわからない
A379_0,379,自分の感情が動く原因がわからない
A380_0,380,よく忘れ物をする
A381_0,381,自分が使ったお金のありかがわからない
A382_0,382,貯金シミュレーションができない
A383_0,383,1日の記録を残すのが面倒
A384_0,384,時間の使い方が下手
A385_0,385,人間関係が面倒くさい
A386_0,386,感覚を言語化するのが大変
A387_0,387,出先で雨が降られてびちゃびちゃ
A388_0,388,目標設定がコロコロ変わる
A389_0,389,スケジュール決めるときに保留になると約束そのものを忘れる
A390_0,390,旅行先のいいところ調べるのが面倒
A391_0,391,発表レイアウト考えるの大変
A392_0,392,実験条件揃えるの考えるのが面倒
A393_0,393,電話先の特定が大変
A394_0,394,美味しい地酒の名前と成分すぐ忘れる
A395_0,395,好きな配信者の配信順がわからない。コラボ含む
A396_0,396,マニュアル作りが面倒
A397_0,397,近所のスーパーや薬局で商品の値段を自宅で簡単に比較できない
A398_0,398,テストや課題の計画を立てて、それに沿って効率よく勉強したいがその計画を立てる時間がない。また最も効率の良い計画を立てるのが難しい
A399_0,399,スーパーで買い物をするとき、一人暮らしで少量しか必要ないのにたくさん入っているものの方が安い時、近くに住んでいる友人や同じようなシチュエーションのクラスメイトと共有して購入したい
A400_0,400,近くの空いている病院を教えてほしい
A401_0,401,家に帰る時間にスーパーが閉まっていることが多々あるので、スーパーに限らず近所の知り合いに代理で購入してもらいたい
A402_0,402,飛行機などのセールが始まるのが会社によってバラバラで忘れてしまったり時間によっては購入できないことがある
A403_0,403,大学で一緒に休日を過ごす友達を作りたいけど作れない
A404_0,404,洗剤やシャンプーなどの消耗品を買い忘れる
A405_0,405,クレジットカードなどお金を使い過ぎてしまう
A406_0,406,家計簿をつけたいが、めんどうくさい
A407_0,407,旅行先で友達を作りたい
A408_0,408,短時間単発のバイトをしたいが内容が大変だったり遠かったりでなかなか条件に合う仕事がない
A409_0,409,お金を払ってでもちょっとした頼み事をしたいときに頼める人がだれか分からない
A410_0,410,どの種類の花粉がどれくらいいつ飛んでいるのかわからなく、薬を用意しておくのを忘れる
A411_0,411,IKEAの商品が組み立てにくい
A412_0,412,授業中に先生までの距離が遠くて発言や質問しづらいことがある
A413_0,413,授業で分からないところがあったときに授業中すぐには聞けない
A414_0,414,気温や天気によって着る服やコーディネートを考えるのが大変
A415_0,415,成績が学期末にならないとちゃんと分からない
A416_0,416,顔の形に合ったパックが欲しい
A417_0,417,母親の飲んでいる薬が多すぎるのか、それとも適量なのかがわからない
A418_0,418,子供にとってそれが虐待にあたるのかどうか判断できない
A419_0,419,忖度すべきかどうかの判断がつかない
A420_0,420,今、自分がここで反論しているのかどうかがわからない
A421_0,421,エクセルで作っているのに、GoogleフォームからのCSVをわざわざ転記しているのが効率的かどうかわからない
A422_0,422,コーヒーなど利尿作用のある飲み物が、水分摂取量にどれだけ含まれるのかがわからない
A423_0,423,飲んでいる飲み物に利尿作用があるのかどうかがわからない
A424_0,424,今日、どれくらいの細胞が古くなったのかがわからない
A425_0,425,今日、どれくらいの細胞が再生して若返ったのかがわからない
A426_0,426,自分の運動・食事・睡眠のバランスが良いのかどうかがわからない
A427_0,427,設定したKPIが正しいものなのかどうかがわからない
A428_0,428,今日の自分の体力に見合った労働時間が何時間なのかがわからない
A429_0,429,シミがどれだけ増えたのかがわからない
A430_0,430,今日何回笑ったのかがわからない
A431_0,431,相手が本当に笑っているのかどうかがわからない
A432_0,432,「今」は昭和何年に相当するのかがわからない
A433_0,433,自分の感情が今「嬉しい」のか「悲しい」のかがはっきりしないことがある
A434_0,434,自分の行動が「休息」なのか「逃避」なのかが判断つかない
A435_0,435,健康診断の数値が悪化したときに、どの生活習慣が原因なのか特定できない
A436_0,436,1日でどの行動が自分の幸福度を高めたのかがわからない
A437_0,437,税金の使われ方がわからない
A438_0,438,政治で何が行われているか実績などがわからない。誰が正しく仕事をしているかがわからない
A439_0,439,土地の価格を瞬時に把握する手段がない
A440_0,440,出席と勤怠管理が異なること
A441_0,441,職業を知ることができない
A442_0,442,起業や節税について誰も知らない
A443_0,443,学習内容が整理されず、復習の仕組みがない
A444_0,444,買い物時にレシピを思い出しながら買うのが手間で整理されていない
A445_0,445,スペルが似ている英単語の識別が難しい
A446_0,446,学生時代に学んだ内容が将来どう活きるか見えにくい
A447_0,447,教材動画が長く、集中が続かない。短い動画が求められている
A448_0,448,デジタルと自然を両立した子ども向け教育法が乏しい
A449_0,449,起業プロセスを気軽に体験できるツールがない
A450_0,450,子供が、デジタルツールを使いつつ、自然に触れる大切さを知る必要がある
A451_0,451,英単語の似ているものを覚えるのが大変
A452_0,452,資本主義において、結果＝お金に偏りすぎて努力が評価されづらい
A453_0,453,紙のメモは後でまとめるのが面倒
A454_0,454,アイデアを出しても整理されず埋もれてしまう
A455_0,455,学生や社会人がアイデアを評価・共有できる仕組みがない
A456_0,456,AIを使ったプロトタイピングが一般に普及していない
A457_0,457,SEOや履歴によって偏った情報ばかり出る検索サイトばかり
A458_0,458,地域や国ごとの偏見がネットで拡散されやすい
A459_0,459,設立など契約書の作成に専門知識が必要でハードルが高い
A460_0,460,自分のビジネスをわかりやすく伝える仕組みがない
A461_0,461,主婦の裁量や努力が可視化・評価されにくい
A462_0,462,多くのラーメン屋で電子決済ができない
A463_0,463,Spotifyでフォロー配信の放送並び替えができない
A464_0,464,公開予定表に空きがあると会議を入れられてしまう
A465_0,465,積読本や積みボードゲームが増えてしまう
A466_0,466,遊び終わったボードゲームの駒などを収納するのに手間取る
A467_0,467,アルゴリズム改変によりSNSで自分に不必要な情報を見てしまう
A468_0,468,外出予定時間と持ち歩く電子デバイスの充電タイミングが噛み合わない
A469_0,469,歩きスマホをしている人が危ない（安全に歩きスマホできると良い）
A470_0,470,天気によって服装の組み合わせを毎日選ぶのが大変
A471_0,471,毎回アンケートに答えるのが大変
A472_0,472,研究発表会の質疑応答が活発化しない
A473_0,473,競合他社の研究開発状況が見えにくい中、自社が優位性を取りにくい
A474_0,474,空いている時に電車に乗車しても、満員になると不快になる
A475_0,475,しっかりと運動する時間を確保できない（隙間時間調整や天候による制限）
A476_0,476,わかりにくいボードゲームのルールに従わなければいけない
A477_0,477,ルーティーン作業が形骸化してしまう
A478_0,478,「答えのないテーマ」を扱う話し合いの結論が、形骸化してしまう
A479_0,479,在宅ワークを訪問セールスによって中断されてしまう
A480_0,480,電車を乗り間違えに暫く気が付かず、遠くまで移動してしまう
A481_0,481,イベントの集合写真撮影に毎回時間がかかりすぎる
A482_0,482,養蜂活動の参加者に参加回数と貢献度がわかるツール
A483_0,483,養蜂活動のスキルアップを示すNFT配布
A484_0,484,マーキングした女王バチを、リアルタイム動画で探し出せるアプリ
A485_0,485,エクセルに取り込んだファイルを、指定先のファイル形式に変更するプログラム
A486_0,486,エクセルのセル内の文字列にキーワードを見つけると、自動的に仕訳をするプログラム
A487_0,487,移動した交通費を精算するプログラム
A488_0,488,銀行勘定帳から、取引先名から経理仕訳を自動化するプログラム
A489_0,489,スキャンしたファイルから、ファイル内のデータを取り込み、ファイル名を自動化するプログラム
A490_0,490,写真を撮影したら、テキストデータを読み取って、自動仕訳するアプリ
A491_0,491,Discord上に上がってくるテキストデータを要約するプログラム
A492_0,492,撮影したバッグなどの写真データから、メーカー名やモデルを類推して割り当てるアプリ
A493_0,493,生涯学習社会において、全国の社会福祉施設で学んだ履歴を残すアプリ
A494_0,494,年間通して病院に行った履歴と費用、交通費などをまとめられるアプリ
A495_0,495,購入した本を、ISBN番号で管理して履歴を残すアプリ
A496_0,496,企業名を撮影することで、法人番号やインボイス適格請求書番号を検索するアプリ
A497_0,497,PDFファイルをドラッグアンドドロップだけで要約するアプリ
A498_0,498,エクセルのセル内の文字列にキーワードを見つけると、自動的に仕訳をするプログラム（重複・統合済）
A499_0,499,物撮り撮影した写真の白抜きを自動化するプログラム
A500_0,500,イベント用あみだくじアプリ
A501_0,501,サイトから相場を抜き出して、エクセルに落とすプログラム
A502_0,502,カーシェアで、車を乗り捨てできない
A503_0,503,ご飯屋さんで、カバンを置く場所がない
A504_0,504,米を研ぐ行為が面倒
A505_0,505,洗濯物を畳むことが面倒
A506_0,506,髪の毛を乾かすのが面倒
A507_0,507,歯を磨くのが面倒
A508_0,508,最寄り駅から絶妙に遠い場所がある
A509_0,509,小雨でも傘をさすべきか迷う
A510_0,510,突然増えた残業がつらい
A511_0,511,ハザードランプの出しっぱなしでバッテリーが上がることがある
A512_0,512,寝転んだ状態から立ち上がるのが面倒
A513_0,513,ハンガーから服が転げ落ちる
A514_0,514,重要書類にハンコを押し忘れる
A515_0,515,ガムを吐き出す場所に困る
A516_0,516,興味のない話をおばさんからされた時の対応に困る
A517_0,517,居酒屋での酒注文がスムーズにいかないことがある
A518_0,518,他人のおならを嗅いでしまった時の不快感
A519_0,519,犬のうんちを踏んでしまった時のストレス
A520_0,520,大きな汗染みを作ってしまった時の恥ずかしさ
A521_0,521,大きな看板に頭をぶつけてしまった時の痛みと恥ずかしさ
A522_0,522,朝、服装を考えるとき、外が寒いか、家の中にいるとわからない
A523_0,523,会社を出る時、傘を忘れて取りに戻ることがある
A524_0,524,遠い会場までの経路を迷う
A525_0,525,届いたメールが迷惑メールか迷う
A526_0,526,イベントの申し込みタイミングを逃すか心配
A527_0,527,スマホのバッテリーが足りなくなり、コンビニで充電器を購入することになる
A528_0,528,家の近くの駅で雨に気付き、コンビニで傘を購入。いくつも貯まる
A529_0,529,日々、体重と体温を計測して記録。たまに忘れることがある
A530_0,530,桜の咲いている公園など、その日通るべきランニングコースはどれか迷う
A531_0,531,管理するパスワードの数が増え続ける
A532_0,532,粗大ゴミを出す指定日を忘れないか心配
A533_0,533,次に髪を切る日を決めるのに予定を毎回確認する必要がある
A534_0,534,電車の何両目に乗ると降りる時に便利かわからない
A535_0,535,家族からの連絡を見逃さないか心配（LINE、電話、メール）
A536_0,536,定期的な引き落としの前に残高が足りているか気になる
A537_0,537,ランニングの準備運動のルーティンが十分には覚えられていない
A538_0,538,毎朝のニュースチェック（日経電子版）に思ったより時間をかけてしまう
A539_0,539,ランニングで普段と違うルートだと、どこにトイレがあるかすぐにわからない
A540_0,540,ランニングが終わる時に、聞いている音声メディアのコンテンツがいいところなので、やむを得ず遠回りする
A541_0,541,練習を決める際に、水泳と自転車とランニングの適切な時間配分がわからない
A542_0,542,家がすぐ汚くなる
A543_0,543,掃除機をかけるのがめんどくさい
A544_0,544,皿洗いを溜めてしまう
A545_0,545,やりたいことがどんどん増えて何から手をつければいいか分からない
A546_0,546,朝早く起きなきゃいけないのに夜更かししてしまう（スマホ見ちゃう）
A547_0,547,いつもギリギリに家を出てしまう
A548_0,548,自分がどれくらい運動不足か知りたい
A549_0,549,メモのファイルを作りすぎて整理する時しか過去のものを見ない
A550_0,550,デザインのまとめ方がわからない（色・レイアウト・用途など分け方が複雑）
A551_0,551,Pinterestはサブボードまで、Notionは関連画像が出ずアップロードが面倒
A552_0,552,いらないスクショがどんどん溜まって消すのを忘れる
A553_0,553,爪を可愛くしたいけど塗るのが面倒、落とすのも面倒
A554_0,554,ネイルがひとつの指でも剥げたら気分が落ちる
A555_0,555,人の名前を忘れる
A556_0,556,電車の空いている号車・扉の位置を知りたい
A557_0,557,現金払いしたものの記録をつけ忘れる
A558_0,558,自分にとって必要な睡眠時間がわからない・すぐに寝られない
A559_0,559,興味ある分野の、頑張れる友達が欲しい
A560_0,560,毎日自分のやる気を上げてほしい
A561_0,561,先輩にどのくらい頼っていいのかわからない
A562_0,562,適切な水分量を取れるようになりたい
A563_0,563,姿勢が良くなりたい
A564_0,564,ずっと座っているので体力が下がっている気がする
A565_0,565,外出時の気温がわからず、帰りに寒い思いをすることがある
A566_0,566,SNSで特定の人にだけ見せる投稿を毎回選択できるようにしたい
A567_0,567,写真を撮ってもあまり使う機会がない
A568_0,568,動画編集をもっとすぐできるようになりたい
A569_0,569,インスタアカウントが多すぎて、どこに何を投稿すればいいかわからない
A570_0,570,ポートフォリオ作りに時間がかかる
A571_0,571,安くて美味しい一人分の料理を作りたい
A572_0,572,おばあちゃんと話してほっこりしたい
A573_0,573,就活の情報をシェアしたい
A574_0,574,喫煙所があるところを知りたい
A575_0,575,買ったコスメが何かを忘れてしまう
A576_0,576,以前どのようなネイルをしたか確認したい
A577_0,577,企業説明会などのスケジュールを一元管理できたら便利
A578_0,578,服のサイズを忘れてしまう
A579_0,579,どこで買ったかを忘れてしまう
A580_0,580,インターン情報を一目で見たい
A581_0,581,メールの要件をまとめてほしい
A582_0,582,お花見の時に桜の種類を知りたい
A583_0,583,X（旧Twitter）が不便
A584_0,584,義務教育の申込書がアナログでめんどくさい
A585_0,585,市役所に行かないと手続きできないのがめんどくさい
A586_0,586,会員登録時に個人情報を入れるのがめんどくさい
A587_0,587,レンタル充電器がスマホの充電が切れてると借りられないのが不便
A588_0,588,推しのイベントカレンダーが欲しい
A589_0,589,薬が無くなる前に教えてほしい
A590_0,590,電車の遅延情報をすぐ知りたい
A591_0,591,銀行のカードが1枚にまとまってほしい
A592_0,592,外出する時に雨の場合のみ通知してほしい
A593_0,593,動画配信コンテンツの新作動画の口コミを知りたい
A594_0,594,変換機能がダメダメ（誤変換が多いなど）
A595_0,595,授業中にスマホをいじってるとノートがとれない
A596_0,596,鞄の中で鍵やイヤホンがすぐ見つからない
A597_0,597,課題の量が多くて優先順位がつけづらい
A598_0,598,授業の空きコマに使える場所がすぐ見つからない
A599_0,599,自販機で買いたい飲み物が売り切れだった
A600_0,600,友達と集まる時、店選びが毎回めんどくさい
A601_0,601,使われてない教室が空いているかどうか分からない
A602_0,602,家を出るまであと何分かわからない
A603_0,603,レポートの提出期限をうっかり忘れる
A604_0,604,授業の内容が難しすぎて家で復習が必須
A605_0,605,ノートを家に忘れて復習できない
A606_0,606,研究室のスケジュールが急に変わるのに伝わらない
A607_0,607,お弁当の中身がいつも同じで飽きる
A608_0,608,授業で使う資料が急に変更される
A609_0,609,「いつ空いてる？」と言われた時にすぐ答えられない
A610_0,610,サークルや研究室の予定がバラバラで調整しづらい
A611_0,611,自分の体調が悪化してるのに気づかない
A612_0,612,電車の遅延情報がリアルタイムで分かりにくい
A613_0,613,学校のWi-Fiがすぐ切れる
A614_0,614,スマホの通知が多すぎて大事な情報を見落とす
A615_0,615,バスが満員で乗れないことがある
A616_0,616,傘を忘れた日に限って雨が降る
A617_0,617,講義の課題提出日を忘れがち
A618_0,618,バスや電車が満員かどうか事前に分からない
A619_0,619,大学のトイレが混んでいて急いでいるときに困る
A620_0,620,カフェの電源席が空いているか行ってみないと分からない
